{"type":"config","name":"Optimizing @nanostores/query bundle size","metricName":"size_bytes","metricUnit":"bytes","bestDirection":"lower"}
{"run":1,"commit":"f3e8510","metric":1908,"metrics":{"raw_bytes":11989},"status":"keep","description":"Baseline: 1908 bytes gzipped, 11989 bytes raw","timestamp":1773917193589,"segment":0,"confidence":null}
{"run":2,"commit":"f3e8510","metric":1907,"metrics":{"raw_bytes":11953},"status":"checks_failed","description":"Date.now as direct reference — 2 test failures (timing issue with revalidation)","timestamp":1773917231986,"segment":0,"confidence":null}
{"run":3,"commit":"f3e8510","metric":1911,"metrics":{"raw_bytes":11961},"status":"discard","description":"Date.now() instead of new Date().getTime() — gzips worse (+3 bytes)","timestamp":1773917270706,"segment":0,"confidence":null}
{"run":4,"commit":"f3e8510","metric":1912,"metrics":{"raw_bytes":11921},"status":"discard","description":"withKey helper for invalidate/revalidate/mutate — adds 4 bytes gzipped","timestamp":1773917369969,"segment":0,"confidence":null}
{"run":5,"commit":"f3e8510","metric":1915,"metrics":{"raw_bytes":11928},"status":"discard","description":"Cache getNow() in variables + rename getCachedValueByKey — worse gzip (+7 bytes)","timestamp":1773917471787,"segment":0,"confidence":null}
{"run":6,"commit":"f3e8510","metric":1921,"metrics":{"raw_bytes":11940},"status":"discard","description":"Inline iterOverCache loops — worse gzip (+13), repetition doesn't help here","timestamp":1773917511790,"segment":0,"confidence":null}
{"run":7,"commit":"f3e8510","metric":1906,"metrics":{"raw_bytes":11971},"status":"checks_failed","description":"Simplify fetcherStore.fetch — unsub called before initialization (sync listener)","timestamp":1773917655403,"segment":0,"confidence":null}
{"run":8,"commit":"f3e8510","metric":1908,"metrics":{"raw_bytes":11960},"status":"discard","description":"Remove async from fetcherStore.fetch — same size, no improvement","timestamp":1773917679015,"segment":0,"confidence":null}
{"run":9,"commit":"db91032","metric":1906,"metrics":{"raw_bytes":11891},"status":"keep","description":"Simplify testKeyAgainstSelector using .call duck-typing + [].concat — saves 2 bytes","timestamp":1773917754440,"segment":0,"confidence":1}
{"run":10,"commit":"db91032","metric":1906,"metrics":{"raw_bytes":11874},"status":"discard","description":"Simplify keyParts null check with == null — same brotli size","timestamp":1773917790942,"segment":0,"confidence":1}
{"run":11,"commit":"f5df43e","metric":1893,"metrics":{"raw_bytes":11809},"status":"keep","description":"Shorten error message + console.warn string — saves 13 bytes total","timestamp":1773917839056,"segment":0,"confidence":7.5}
{"run":12,"commit":"e182b4b","metric":1880,"metrics":{"raw_bytes":11710},"status":"keep","description":"Remove console.warn in __unsafeOverruleSettings + Error() without new — saves 13 bytes","timestamp":1773917891594,"segment":0,"confidence":11.2}
{"run":13,"commit":"413c83c","metric":1868,"metrics":{"raw_bytes":11590},"status":"keep","description":"Merge handleNewListener and runRefetcher into single function — saves 12 bytes","timestamp":1773917962284,"segment":0,"confidence":10}
{"run":14,"commit":"413c83c","metric":1872,"metrics":{"raw_bytes":11550},"status":"discard","description":"Reuse handleNewListener in cacheKeyChangeHandler — worse brotli (+4 despite raw saving)","timestamp":1773917992288,"segment":0,"confidence":8}
{"run":15,"commit":"413c83c","metric":1871,"metrics":{"raw_bytes":11579},"status":"discard","description":"Simplify isSomeKey check — worse brotli (+3 bytes)","timestamp":1773918034765,"segment":0,"confidence":6.666666666666667}
{"run":16,"commit":"413c83c","metric":1876,"metrics":{"raw_bytes":11600},"status":"discard","description":"Simplify setAsLoading with conditional assignment — worse brotli (+8)","timestamp":1773918109746,"segment":0,"confidence":5.333333333333333}
{"run":17,"commit":"13964ec","metric":1866,"metrics":{"raw_bytes":11591},"status":"keep","description":"Replace evtUnsubs.forEach with for...of — saves 2 bytes brotli","timestamp":1773918149665,"segment":0,"confidence":4.666666666666667}
{"run":18,"commit":"13964ec","metric":1870,"metrics":{"raw_bytes":11613},"status":"discard","description":"Replace forEach(fn) with for...of in mutator — worse brotli (+4)","timestamp":1773918183117,"segment":0,"confidence":3.8181818181818183}
{"run":19,"commit":"8130512","metric":1860,"metrics":{"raw_bytes":11522},"status":"keep","description":"Inline getCachedValueByKey at both call sites, remove function — saves 6 bytes","timestamp":1773918227293,"segment":0,"confidence":3.6923076923076925}
{"run":20,"commit":"f16f644","metric":1850,"metrics":{"raw_bytes":11511},"status":"keep","description":"Simplify browser.ts subscribe — remove isServer variable, use expression — saves 10 bytes","timestamp":1773918283633,"segment":0,"confidence":3.3142857142857145}
{"run":21,"commit":"0d3b2e3","metric":1848,"metrics":{"raw_bytes":11498},"status":"keep","description":"Cache typeof window check in canSub boolean, remove subscribe function — saves 2 bytes","timestamp":1773918329476,"segment":0,"confidence":3.1578947368421053}
{"run":22,"commit":"ed35648","metric":1845,"metrics":{"raw_bytes":11497},"status":"keep","description":"Optimize mutator opts destructuring with ?? operator — saves 3 bytes","timestamp":1773918376082,"segment":0,"confidence":3.073170731707317}
{"run":23,"commit":"ed35648","metric":1850,"metrics":{"raw_bytes":11480},"status":"discard","description":"Simplify keyParts null check again — still worse brotli (+5)","timestamp":1773918436613,"segment":0,"confidence":2.423076923076923}
{"run":24,"commit":"df811f1","metric":1840,"metrics":{"raw_bytes":11456},"status":"keep","description":"Remove explicit void 0 properties in mutator store.set() — saves 5 bytes","timestamp":1773918468687,"segment":0,"confidence":2.4285714285714284}
{"run":25,"commit":"63e1206","metric":1839,"metrics":{"raw_bytes":11450},"status":"keep","description":"Replace Symbol() with {} for fetcherSymbol — saves 1 byte brotli","timestamp":1773918524935,"segment":0,"confidence":2.3}
{"run":26,"commit":"2afb5b4","metric":1834,"metrics":{"raw_bytes":11420},"status":"keep","description":"Convert setKeyStoreValue if/else to ternary expression — saves 5 bytes","timestamp":1773918565976,"segment":0,"confidence":2.4262295081967213}
{"run":27,"commit":"782dca2","metric":1831,"metrics":{"raw_bytes":11409},"status":"keep","description":"Replace new Date().getTime() with +new Date() — saves 3 bytes","timestamp":1773918607601,"segment":0,"confidence":2.40625}
{"run":28,"commit":"738aaf9","metric":1830,"metrics":{"raw_bytes":11395},"status":"keep","description":"Combine prevKey = fetcherStore.key = newKey assignment — saves 1 byte","timestamp":1773918733071,"segment":0,"confidence":2.4375}
{"run":29,"commit":"738aaf9","metric":1840,"metrics":{"raw_bytes":11380},"status":"discard","description":"cacheEntry helper for created/expires — worse brotli (+10)","timestamp":1773918804589,"segment":0,"confidence":2.5161290322580645}
{"run":30,"commit":"738aaf9","metric":1831,"metrics":{"raw_bytes":11413},"status":"checks_failed","description":"Direct value assignment in mutator onStop — TypeCheckError: value is read-only","timestamp":1773918863437,"segment":0,"confidence":2.5161290322580645}
{"run":31,"commit":"738aaf9","metric":1831,"metrics":{"raw_bytes":11413},"status":"discard","description":"Direct value assignment with type cast in mutator onStop — +1 byte","timestamp":1773918889139,"segment":0,"confidence":2.5161290322580645}
{"run":32,"commit":"738aaf9","metric":1833,"metrics":{"raw_bytes":11329},"status":"discard","description":"Direct fetcherStore.key access instead of destructuring — worse brotli (+3)","timestamp":1773918948890,"segment":0,"confidence":2.4}
{"run":33,"commit":"6c60f96","metric":1826,"metrics":{"raw_bytes":11292},"status":"keep","description":"Replace keysAsStoresToIndexes Map with parallel arrays — saves 4 bytes, eliminates 1 TS error","timestamp":1773918999484,"segment":0,"confidence":2.411764705882353}
{"run":34,"commit":"474a08b","metric":1825,"metrics":{"raw_bytes":11286},"status":"keep","description":"Remove unnecessary async from fetcherStore.fetch — saves 1 byte","timestamp":1773919034069,"segment":0,"confidence":2.4776119402985075}
{"run":35,"commit":"227a3ad","metric":1819,"metrics":{"raw_bytes":11207},"status":"keep","description":"Replace _revalidateOnInterval Map with local variable — saves 6 bytes","timestamp":1773919095063,"segment":0,"confidence":2.696969696969697}
{"run":36,"commit":"4b898a4","metric":1811,"metrics":{"raw_bytes":11174},"status":"keep","description":"Inline safeKeySet in createMutatorStore — saves 8 bytes","timestamp":1773919210635,"segment":0,"confidence":3.129032258064516}
{"run":37,"commit":"48b7a80","metric":1810,"metrics":{"raw_bytes":11156},"status":"keep","description":"Use .push.bind() for invalidate/revalidate callbacks in mutator — saves 1 byte","timestamp":1773919269322,"segment":0,"confidence":3.3793103448275863}
{"run":38,"commit":"48b7a80","metric":1810,"metrics":{"raw_bytes":11148},"status":"discard","description":"Shorten error message further — same brotli","timestamp":1773919301335,"segment":0,"confidence":4}
{"run":39,"commit":"9ec6fb3","metric":1809,"metrics":{"raw_bytes":11152},"status":"keep","description":"Replace () => {} with noop in getKeyStore — saves 1 byte","timestamp":1773919340338,"segment":0,"confidence":4.125}
{"run":40,"commit":"9ec6fb3","metric":1809,"metrics":{"raw_bytes":11150},"status":"discard","description":"Replace if (shouldRevalidate) with && — same brotli","timestamp":1773919373440,"segment":0,"confidence":4.040816326530612}
{"run":41,"commit":"9ec6fb3","metric":1816,"metrics":{"raw_bytes":11192},"status":"discard","description":"Inline setAsLoading — worse brotli (+7), unique code paths compress poorly","timestamp":1773919426776,"segment":0,"confidence":3.96}
{"run":42,"commit":"f6e07c2","metric":1800,"metrics":{"raw_bytes":11117},"status":"keep","description":"Replace for loop with forEach in getKeyStore — saves 9 bytes, crosses 1800!","timestamp":1773919492643,"segment":0,"confidence":4.235294117647059}
{"run":43,"commit":"55f73d3","metric":1795,"metrics":{"raw_bytes":11093},"status":"keep","description":"Replace for loop with forEach in batched callback — saves 5 bytes","timestamp":1773919537328,"segment":0,"confidence":4.035714285714286}
{"run":44,"commit":"57e5a79","metric":1789,"metrics":{"raw_bytes":11088},"status":"keep","description":"Replace for...of cache.keys() with cache.forEach in iterOverCache — saves 6 bytes, eliminates last TS error","timestamp":1773919563523,"segment":0,"confidence":4.175438596491228}
{"run":45,"commit":"b5e0d39","metric":1786,"metrics":{"raw_bytes":11087},"status":"keep","description":"Replace for...of evtUnsubs with forEach (matches other forEach patterns) — saves 3 bytes","timestamp":1773919587728,"segment":0,"confidence":4.206896551724138}
{"run":46,"commit":"b5e0d39","metric":1792,"metrics":{"raw_bytes":11056},"status":"discard","description":"Inline __unsafeOverruleSettings in return — worse brotli (+6)","timestamp":1773919644254,"segment":0,"confidence":4}
{"run":47,"commit":"b5e0d39","metric":1787,"metrics":{"raw_bytes":11076},"status":"discard","description":"Convert defaultOnErrorRetry to arrow function — +1 byte","timestamp":1773919767502,"segment":0,"confidence":4.066666666666666}
{"run":48,"commit":"0284ac0","metric":1782,"metrics":{"raw_bytes":11091},"status":"keep","description":"Convert createMutatorStore from function declaration to arrow — saves 4 bytes","timestamp":1773919817844,"segment":0,"confidence":4.131147540983607}
{"run":49,"commit":"5255917","metric":1778,"metrics":{"raw_bytes":11084},"status":"keep","description":"Convert isSomeKey and noop from function to arrow — saves 4 bytes","timestamp":1773919846628,"segment":0,"confidence":4.193548387096774}
